Centro Superior Una de Catalão,S
Centro Universitário SOCIESC de Blumenau,S
Centro Universitário SOCIESC de Curitiba,S
Centro Universitário Sociesc,S
Centro Universitário São Judas Tadeu,S
Centro Universitário Una,S
Centro Universitário Una de Bom Despacho,S
Centro Universitário de Belo Horizonte,S
Centro de Educação Tecnológica Tupy de São Bento do Sul,S
Escola Superior São Judas de Guarulhos,S
Escola Superior São Judas de Limeira,S
Escola Superior São Judas de São Bernardo do Campo,S
Escola Superior Una de Barreiras,S
Escola Superior Una de Conselheiro Lafaiete,S
Escola Superior Una de Itumbiara,S
Faculdade Divinópolis,S
Faculdade Sociesc de Balneário Camboriú,S
Faculdade Socisc de Florianópolis,S
Faculdade Sociesc de Jaraguá do Sul,S
Faculdade São Judas de Limeira,S
Faculdade São Judas de São Bernardo do Campo,S
Faculdade UNA de Sete Lagoas,S
Faculdade Una Nova Serrana,S
Faculdade Una de Barreiras,S
Faculdade Una de Catalão,S
Faculdade Una de Conselheiro Lafaiete,S
Faculdade Una de Contagem,S
Faculdade Una de Divinópolis,S
Faculdade Una de Itumbiara,S
Faculdade Una de Jataí,S
Faculdade Una de Pouso Alegre,S
Faculdade Una de Uberlândia,S
Faculdade de Agronomia Una de Barreiras,S
Faculdade de Agronomia Una de Conselheiro Lafaiete,S
Faculdade de Agronomia Una de Itumbiara,S
Instituto Universitário São Judas de Garulhos,S
Instituto Universitário São Judas de Limeira,S
Instituto Universitário São Judas de São Bernardo do Campo,S
Instituto Universitário Una de Barreiras,S
Instituto Universitário Una de Catalão,S
Instituto Universitário Una de Conselheiro Lafaiete,S
Instituto Universitário Una de Itumbiara,S
Universidade São Judas Tadeu,S
